category,name,price,description,image
sofa,Floral wing Chair,12000,A very comfortable chair type sofa for any family member at very low cost,https://www.woodenstreet.com/image/cache/data/wing-chairs/joan-wingback-chair/updated/olive-gold/front-NEW-533x368.jpg
sofa,Two seater grey sofa,20000,A two seater sofa with very attractive color of two people,https://www.hometown.in/media/product/79/2453/22577/1.jpg
sofa,Leather sofa,35000,A very comfortable leather  sofa for family at very affordable price,https://images-na.ssl-images-amazon.com/images/I/81rQqhEs2cL._SL1500_.jpg
sofa,Large sofa,50000,A full size sofa for big family at very affordable price,https://lillyputinterio.com/wp-content/uploads/2019/10/Fursure-Rexine-and-Velvet-Upholstered-L-Shape-5-Seater-Sofa-Bed-Brown.jpg
tables,Coffe table,5000,A perfect sized coffee table for you and your family,https://www.ulcdn.net/opt/www.ulcdn.net/images/products/162726/slide/666x363/Alita_Storage_Coffee_Table_Half_3.jpg?1515145466
tables,Dining Table,10000,A perfect sized dining table for you and your family,https://cdn.shopify.com/s/files/1/0191/2234/products/DSC_3858_2048x.jpg?v=1529687354
tables,Bedside Table,3500,A small and unique bedside table that will decorate your bedroom,https://rukminim1.flixcart.com/image/832/832/jlqwpe80-1/side-table/4/f/t/rosewood-sheesham-alqvil01bst-bedside-table-alquiler-provincial-original-imaf8t49a3hfxd3q.jpeg?q=70
tables,Central Table,15000,A very attractive wooden central table that will decorate your Drawing room,https://5.imimg.com/data5/AR/CH/MY-48380690/winebarrelcentral-table-500x500.jpg
